{
  "$schema": "../../../schema/blocks/diagram.schema.json",
  "title": "Một lệnh đi qua Redis",
  "nodes": [
    {"id": "clients", "label": "Client (Lettuce)", "kind": "client", "x": 0.1, "y": 0.05},
    {"id": "io", "label": "I/O threads", "kind": "service", "x": 0.85, "y": 0.05},
    {"id": "mem", "label": "Dữ liệu trong RAM", "kind": "cache", "x": 0.1, "y": 0.5},
    {"id": "main", "label": "Luồng chính", "kind": "service", "x": 0.85, "y": 0.5},
    {"id": "fork", "label": "Process con (RDB)", "kind": "generic", "x": 0.1, "y": 0.95},
    {"id": "aof", "label": "AOF + fsync", "kind": "database", "x": 0.85, "y": 0.95}
  ],
  "edges": [
    {"id": "clients-io", "from": "clients", "to": "io", "label": "gửi lệnh"},
    {"id": "io-main", "from": "io", "to": "main", "label": "lệnh đã đọc"},
    {"id": "main-mem", "from": "main", "to": "mem", "label": "thực thi tuần tự"},
    {"id": "main-aof", "from": "main", "to": "aof", "label": "ghi lệnh ghi"},
    {"id": "mem-fork", "from": "mem", "to": "fork", "label": "fork, copy-on-write"}
  ],
  "steps": [
    {"caption": "Nhiều client gửi lệnh qua mạng. Từ Redis 6, I/O thread có thể lo phần đọc request và ghi response.", "show": ["clients", "io", "clients-io"], "highlight": ["clients-io"]},
    {"caption": "Mọi lệnh được đưa vào một luồng chính duy nhất, xếp hàng và thực thi từng lệnh một.", "show": ["main", "io-main"], "highlight": ["io-main"]},
    {"caption": "Luồng chính đọc ghi cấu trúc dữ liệu trong RAM. Mỗi lệnh nguyên tử, không cần khoá; nhưng một lệnh O(N) trên key lớn bắt cả hàng đợi chờ.", "show": ["mem", "main-mem"], "highlight": ["main-mem"]},
    {"caption": "Lệnh ghi được nối vào AOF; với appendfsync everysec, luồng nền fsync mỗi giây, nên khi sập có thể mất khoảng 1–2 giây.", "show": ["aof", "main-aof"], "highlight": ["main-aof"]},
    {"caption": "Snapshot RDB: Redis fork một process con. Fork phải sao chép bảng trang nên dừng luồng chính một lúc; trong lúc snapshot, mỗi page bị ghi được sao chép (copy-on-write), RAM có thể tăng gần gấp đôi.", "show": ["fork", "mem-fork"], "highlight": ["mem-fork"]}
  ]
}
